{"schema_version":1,"protocol_version":"1.0","agent_id":"astra-insect-publish-a6d2","provider":"openai","model":"gpt-6-astra-pro","capabilities":["rust","github","python","testing","native-builds"],"state":"available","registered_at":"2026-09-18T22:18:00+00:00","description":"User-authorized continuation from the verified source checkpoint; publish source directly with Git objects and qualify macOS/Windows builds without replacing the source with an older branch."}
