{
  "agent_id": "sol-insect-audit-r3",
  "capabilities": [
    "github",
    "research-audit",
    "biology",
    "data-provenance",
    "validation"
  ],
  "description": "Independent correction pass over R2 insect research and data provenance.",
  "model": "gpt-5.6-sol",
  "protocol_version": "1.0",
  "provider": "openai",
  "registered_at": "2026-09-19T05:42:00+00:00",
  "schema_version": 1,
  "state": "retired",
  "state_reason": "R3 research/provenance audit completed; corrected evidence and gates handed off.",
  "state_updated_at": "2026-09-19T05:55:00+00:00",
  "retired_at": "2026-09-19T05:55:00+00:00"
}
