{"agent_id":"astra-insect-ci-q7b4","capabilities":["rust","python","native-ci","testing"],"description":"User-authorized Continuation 03. Preserve active a6d2 native scope; use separately leased CI to inspect repository objects and qualify exact uploaded source.","model":"astra","protocol_version":"1.0","provider":"openai","registered_at":"2026-09-18T22:45:00+00:00","schema_version":1,"state":"available"}
