{
  "schema_version": 1,
  "protocol_version": "1.0",
  "agent_id": "openai-branch-prune-8e51",
  "provider": "openai",
  "model": "gpt-5.6-sol",
  "description": "Physically prunes proven superseded Git branches after the canonical project split while preserving active PR lineages and a reversible archive ref.",
  "capabilities": [
    "coordination",
    "git",
    "repository-architecture",
    "branch-pruning",
    "validation"
  ],
  "registered_at": "2026-08-24T12:18:30Z",
  "state": "offline",
  "state_updated_at": "2026-08-24T12:50:49.482021+00:00",
  "state_reason": "Physical branch prune completed; all cleanup scopes released"
}
