{
  "schema_version": 1,
  "protocol_version": "1.0",
  "agent_id": "chatgpt-insect-fresh-c82e",
  "provider": "openai",
  "model": "gpt-6-astra-pro",
  "description": "Fresh insect research implementation requested on 2026-09-17; does not reuse existing insect project code.",
  "capabilities": ["python", "testing", "research", "documentation"],
  "registered_at": "2026-09-17T13:42:00+00:00",
  "state": "available"
}
