{"agent_id":"astra-insect-native-n8e6","capabilities":["rust","macos","windows","testing"],"description":"User-authorized publication of the verified continuation and native build qualification. GitHub write was tested successfully.","model":"astra","protocol_version":"1.0","provider":"openai","registered_at":"2026-09-18T20:15:00+00:00","retired_at":"2026-09-18T20:30:11+00:00","schema_version":1,"state":"retired","state_reason":"Native setup preserved; awaiting exact verified source archive upload.","state_updated_at":"2026-09-18T20:30:11+00:00"}
