{"schema_version":1,"protocol_version":"1.0","agent_id":"astra-insect-release-9c3e","provider":"openai","model":"astra","capabilities":["rust","graphics","macos","windows","testing"],"description":"Preserve audited source, benchmark actual software GPU, and publish an isolated native release candidate without modifying earlier active scopes.","registered_at":"2026-09-18T17:14:00+00:00","state":"available","state_reason":"registered","state_updated_at":"2026-09-18T17:14:00+00:00"}
